2.005094 IP 1.1.2.1.49153 > 100.1.2.1.8080: Flags [S], seq 0, win 65535, options [TS val 2000 ecr 0,wscale 6,sackOK,eol], length 0
2.005094 IP 100.1.2.1.8080 > 1.1.2.1.49153: Flags [S.], seq 0, ack 1, win 65535, options [TS val 2005 ecr 2000,wscale 6,sackOK,eol], length 0
2.015172 IP 1.1.2.1.49153 > 100.1.2.1.8080: Flags [.], ack 1, win 32768, options [TS val 2010 ecr 2005,eol], length 0
2.015303 IP 1.1.2.1.49153 > 100.1.2.1.8080: Flags [.], seq 1:1441, ack 1, win 32768, options [TS val 2010 ecr 2005,eol], length 1440: HTTP
2.015303 IP 100.1.2.1.8080 > 1.1.2.1.49153: Flags [.], ack 1441, win 32768, options [TS val 2015 ecr 2010,eol], length 0
2.015422 IP 1.1.2.1.49153 > 100.1.2.1.8080: Flags [.], seq 1441:2881, ack 1, win 32768, options [TS val 2010 ecr 2005,eol], length 1440: HTTP
2.015542 IP 1.1.2.1.49153 > 100.1.2.1.8080: Flags [.], seq 2881:4321, ack 1, win 32768, options [TS val 2010 ecr 2005,eol], length 1440: HTTP
2.015542 IP 100.1.2.1.8080 > 1.1.2.1.49153: Flags [.], ack 4321, win 32768, options [TS val 2015 ecr 2010,eol], length 0
2.015661 IP 1.1.2.1.49153 > 100.1.2.1.8080: Flags [.], seq 4321:5761, ack 1, win 32768, options [TS val 2010 ecr 2005,eol], length 1440: HTTP
2.015781 IP 1.1.2.1.49153 > 100.1.2.1.8080: Flags [.], seq 5761:7201, ack 1, win 32768, options [TS val 2010 ecr 2005,eol], length 1440: HTTP
2.015781 IP 100.1.2.1.8080 > 1.1.2.1.49153: Flags [.], ack 7201, win 32768, options [TS val 2015 ecr 2010,eol], length 0
2.015900 IP 1.1.2.1.49153 > 100.1.2.1.8080: Flags [.], seq 7201:8641, ack 1, win 32768, options [TS val 2010 ecr 2005,eol], length 1440: HTTP
2.016020 IP 1.1.2.1.49153 > 100.1.2.1.8080: Flags [.], seq 8641:10081, ack 1, win 32768, options [TS val 2010 ecr 2005,eol], length 1440: HTTP
2.016020 IP 100.1.2.1.8080 > 1.1.2.1.49153: Flags [.], ack 10081, win 32768, options [TS val 2016 ecr 2010,eol], length 0
2.016139 IP 1.1.2.1.49153 > 100.1.2.1.8080: Flags [.], seq 10081:11521, ack 1, win 32768, options [TS val 2010 ecr 2005,eol], length 1440: HTTP
2.016259 IP 1.1.2.1.49153 > 100.1.2.1.8080: Flags [.], seq 11521:12961, ack 1, win 32768, options [TS val 2010 ecr 2005,eol], length 1440: HTTP
2.016259 IP 100.1.2.1.8080 > 1.1.2.1.49153: Flags [.], ack 12961, win 32768, options [TS val 2016 ecr 2010,eol], length 0
2.016378 IP 1.1.2.1.49153 > 100.1.2.1.8080: Flags [.], seq 12961:14401, ack 1, win 32768, options [TS val 2010 ecr 2005,eol], length 1440: HTTP
2.025451 IP 1.1.2.1.49153 > 100.1.2.1.8080: Flags [.], seq 14401:15841, ack 1, win 32768, options [TS val 2020 ecr 2015,eol], length 1440: HTTP
2.025451 IP 100.1.2.1.8080 > 1.1.2.1.49153: Flags [.], ack 15841, win 32768, options [TS val 2025 ecr 2010,eol], length 0
2.025571 IP 1.1.2.1.49153 > 100.1.2.1.8080: Flags [.], seq 15841:17281, ack 1, win 32768, options [TS val 2020 ecr 2015,eol], length 1440: HTTP
2.025815 IP 1.1.2.1.49153 > 100.1.2.1.8080: Flags [.], seq 17281:18721, ack 1, win 32768, options [TS val 2020 ecr 2015,eol], length 1440: HTTP
2.025815 IP 100.1.2.1.8080 > 1.1.2.1.49153: Flags [.], ack 18721, win 32768, options [TS val 2025 ecr 2020,eol], length 0
2.025934 IP 1.1.2.1.49153 > 100.1.2.1.8080: Flags [.], seq 18721:20161, ack 1, win 32768, options [TS val 2020 ecr 2015,eol], length 1440: HTTP
2.026054 IP 1.1.2.1.49153 > 100.1.2.1.8080: Flags [.], seq 20161:21601, ack 1, win 32768, options [TS val 2020 ecr 2015,eol], length 1440: HTTP
2.026054 IP 100.1.2.1.8080 > 1.1.2.1.49153: Flags [.], ack 21601, win 32768, options [TS val 2026 ecr 2020,eol], length 0
2.026297 IP 1.1.2.1.49153 > 100.1.2.1.8080: Flags [.], seq 21601:23041, ack 1, win 32768, options [TS val 2020 ecr 2015,eol], length 1440: HTTP
2.026417 IP 1.1.2.1.49153 > 100.1.2.1.8080: Flags [.], seq 23041:24481, ack 1, win 32768, options [TS val 2020 ecr 2015,eol], length 1440: HTTP
2.026417 IP 100.1.2.1.8080 > 1.1.2.1.49153: Flags [.], ack 24481, win 32768, options [TS val 2026 ecr 2020,eol], length 0
2.026536 IP 1.1.2.1.49153 > 100.1.2.1.8080: Flags [.], seq 24481:25921, ack 1, win 32768, options [TS val 2020 ecr 2015,eol], length 1440: HTTP
2.026780 IP 1.1.2.1.49153 > 100.1.2.1.8080: Flags [.], seq 25921:27361, ack 1, win 32768, options [TS val 2021 ecr 2016,eol], length 1440: HTTP
2.026780 IP 100.1.2.1.8080 > 1.1.2.1.49153: Flags [.], ack 27361, win 32768, options [TS val 2026 ecr 2020,eol], length 0
2.026900 IP 1.1.2.1.49153 > 100.1.2.1.8080: Flags [.], seq 27361:28801, ack 1, win 32768, options [TS val 2021 ecr 2016,eol], length 1440: HTTP
2.027143 IP 1.1.2.1.49153 > 100.1.2.1.8080: Flags [.], seq 28801:30241, ack 1, win 32768, options [TS val 2021 ecr 2016,eol], length 1440: HTTP
2.027143 IP 100.1.2.1.8080 > 1.1.2.1.49153: Flags [.], ack 30241, win 32768, options [TS val 2027 ecr 2021,eol], length 0
2.027263 IP 1.1.2.1.49153 > 100.1.2.1.8080: Flags [.], seq 30241:31681, ack 1, win 32768, options [TS val 2021 ecr 2016,eol], length 1440: HTTP
2.027382 IP 1.1.2.1.49153 > 100.1.2.1.8080: Flags [.], seq 31681:33121, ack 1, win 32768, options [TS val 2021 ecr 2016,eol], length 1440: HTTP
2.027382 IP 100.1.2.1.8080 > 1.1.2.1.49153: Flags [.], ack 33121, win 32768, options [TS val 2027 ecr 2021,eol], length 0
2.027626 IP 1.1.2.1.49153 > 100.1.2.1.8080: Flags [.], seq 33121:34561, ack 1, win 32768, options [TS val 2021 ecr 2016,eol], length 1440: HTTP
2.035689 IP 1.1.2.1.49153 > 100.1.2.1.8080: Flags [.], seq 34561:36001, ack 1, win 32768, options [TS val 2030 ecr 2025,eol], length 1440: HTTP
2.035689 IP 100.1.2.1.8080 > 1.1.2.1.49153: Flags [.], ack 36001, win 32768, options [TS val 2035 ecr 2021,eol], length 0
2.035809 IP 1.1.2.1.49153 > 100.1.2.1.8080: Flags [.], seq 36001:37441, ack 1, win 32768, options [TS val 2030 ecr 2025,eol], length 1440: HTTP
2.035928 IP 1.1.2.1.49153 > 100.1.2.1.8080: Flags [.], seq 37441:38881, ack 1, win 32768, options [TS val 2030 ecr 2025,eol], length 1440: HTTP
2.035928 IP 100.1.2.1.8080 > 1.1.2.1.49153: Flags [.], ack 38881, win 32768, options [TS val 2035 ecr 2030,eol], length 0
2.036172 IP 1.1.2.1.49153 > 100.1.2.1.8080: Flags [.], seq 38881:40321, ack 1, win 32768, options [TS val 2030 ecr 2025,eol], length 1440: HTTP
2.036291 IP 1.1.2.1.49153 > 100.1.2.1.8080: Flags [.], seq 40321:41761, ack 1, win 32768, options [TS val 2030 ecr 2025,eol], length 1440: HTTP
2.036291 IP 100.1.2.1.8080 > 1.1.2.1.49153: Flags [.], ack 41761, win 32768, options [TS val 2036 ecr 2030,eol], length 0
2.036411 IP 1.1.2.1.49153 > 100.1.2.1.8080: Flags [.], seq 41761:43201, ack 1, win 32768, options [TS val 2030 ecr 2025,eol], length 1440: HTTP
2.036655 IP 1.1.2.1.49153 > 100.1.2.1.8080: Flags [.], seq 43201:44641, ack 1, win 32768, options [TS val 2031 ecr 2026,eol], length 1440: HTTP
2.036655 IP 100.1.2.1.8080 > 1.1.2.1.49153: Flags [.], ack 44641, win 32768, options [TS val 2036 ecr 2030,eol], length 0
2.036774 IP 1.1.2.1.49153 > 100.1.2.1.8080: Flags [.], seq 44641:46081, ack 1, win 32768, options [TS val 2031 ecr 2026,eol], length 1440: HTTP
2.036894 IP 1.1.2.1.49153 > 100.1.2.1.8080: Flags [.], seq 46081:47521, ack 1, win 32768, options [TS val 2031 ecr 2026,eol], length 1440: HTTP
2.036894 IP 100.1.2.1.8080 > 1.1.2.1.49153: Flags [.], ack 47521, win 32768, options [TS val 2036 ecr 2031,eol], length 0
2.037261 IP 1.1.2.1.49153 > 100.1.2.1.8080: Flags [.], seq 47521:48961, ack 1, win 32768, options [TS val 2031 ecr 2026,eol], length 1440: HTTP
2.037381 IP 1.1.2.1.49153 > 100.1.2.1.8080: Flags [.], seq 48961:50401, ack 1, win 32768, options [TS val 2031 ecr 2026,eol], length 1440: HTTP
2.037381 IP 100.1.2.1.8080 > 1.1.2.1.49153: Flags [.], ack 50401, win 32768, options [TS val 2037 ecr 2031,eol], length 0
2.037500 IP 1.1.2.1.49153 > 100.1.2.1.8080: Flags [.], seq 50401:51841, ack 1, win 32768, options [TS val 2031 ecr 2026,eol], length 1440: HTTP
2.037744 IP 1.1.2.1.49153 > 100.1.2.1.8080: Flags [.], seq 51841:53281, ack 1, win 32768, options [TS val 2031 ecr 2026,eol], length 1440: HTTP
2.037744 IP 100.1.2.1.8080 > 1.1.2.1.49153: Flags [.], ack 53281, win 32768, options [TS val 2037 ecr 2031,eol], length 0
2.037864 IP 1.1.2.1.49153 > 100.1.2.1.8080: Flags [.], seq 53281:54721, ack 1, win 32768, options [TS val 2031 ecr 2026,eol], length 1440: HTTP
2.037983 IP 1.1.2.1.49153 > 100.1.2.1.8080: Flags [.], seq 54721:56161, ack 1, win 32768, options [TS val 2031 ecr 2026,eol], length 1440: HTTP
2.037983 IP 100.1.2.1.8080 > 1.1.2.1.49153: Flags [.], ack 56161, win 32768, options [TS val 2037 ecr 2031,eol], length 0
2.038351 IP 1.1.2.1.49153 > 100.1.2.1.8080: Flags [.], seq 56161:57601, ack 1, win 32768, options [TS val 2032 ecr 2027,eol], length 1440: HTTP
2.038471 IP 1.1.2.1.49153 > 100.1.2.1.8080: Flags [.], seq 57601:59041, ack 1, win 32768, options [TS val 2032 ecr 2027,eol], length 1440: HTTP
2.038471 IP 100.1.2.1.8080 > 1.1.2.1.49153: Flags [.], ack 59041, win 32768, options [TS val 2038 ecr 2032,eol], length 0
2.038590 IP 1.1.2.1.49153 > 100.1.2.1.8080: Flags [.], seq 59041:60481, ack 1, win 32768, options [TS val 2032 ecr 2027,eol], length 1440: HTTP
2.038834 IP 1.1.2.1.49153 > 100.1.2.1.8080: Flags [.], seq 60481:61921, ack 1, win 32768, options [TS val 2032 ecr 2027,eol], length 1440: HTTP
2.038834 IP 100.1.2.1.8080 > 1.1.2.1.49153: Flags [.], ack 61921, win 32768, options [TS val 2038 ecr 2032,eol], length 0
2.038953 IP 1.1.2.1.49153 > 100.1.2.1.8080: Flags [.], seq 61921:63361, ack 1, win 32768, options [TS val 2032 ecr 2027,eol], length 1440: HTTP
2.039073 IP 1.1.2.1.49153 > 100.1.2.1.8080: Flags [.], seq 63361:64801, ack 1, win 32768, options [TS val 2032 ecr 2027,eol], length 1440: HTTP
2.039073 IP 100.1.2.1.8080 > 1.1.2.1.49153: Flags [.], ack 64801, win 32768, options [TS val 2039 ecr 2032,eol], length 0
2.045838 IP 1.1.2.1.49153 > 100.1.2.1.8080: Flags [.], seq 64801:66241, ack 1, win 32768, options [TS val 2040 ecr 2035,eol], length 1440: HTTP
2.045957 IP 1.1.2.1.49153 > 100.1.2.1.8080: Flags [.], seq 66241:67681, ack 1, win 32768, options [TS val 2040 ecr 2035,eol], length 1440: HTTP
2.045957 IP 100.1.2.1.8080 > 1.1.2.1.49153: Flags [.], ack 67681, win 32768, options [TS val 2045 ecr 2040,eol], length 0
2.046077 IP 1.1.2.1.49153 > 100.1.2.1.8080: Flags [.], seq 67681:69121, ack 1, win 32768, options [TS val 2040 ecr 2035,eol], length 1440: HTTP
2.046320 IP 1.1.2.1.49153 > 100.1.2.1.8080: Flags [.], seq 69121:70561, ack 1, win 32768, options [TS val 2040 ecr 2035,eol], length 1440: HTTP
2.046320 IP 100.1.2.1.8080 > 1.1.2.1.49153: Flags [.], ack 70561, win 32768, options [TS val 2046 ecr 2040,eol], length 0
2.046440 IP 1.1.2.1.49153 > 100.1.2.1.8080: Flags [.], seq 70561:72001, ack 1, win 32768, options [TS val 2040 ecr 2035,eol], length 1440: HTTP
2.046559 IP 1.1.2.1.49153 > 100.1.2.1.8080: Flags [.], seq 72001:73441, ack 1, win 32768, options [TS val 2040 ecr 2035,eol], length 1440: HTTP
2.046559 IP 100.1.2.1.8080 > 1.1.2.1.49153: Flags [.], ack 73441, win 32768, options [TS val 2046 ecr 2040,eol], length 0
2.046927 IP 1.1.2.1.49153 > 100.1.2.1.8080: Flags [.], seq 73441:74881, ack 1, win 32768, options [TS val 2041 ecr 2036,eol], length 1440: HTTP
2.047047 IP 1.1.2.1.49153 > 100.1.2.1.8080: Flags [.], seq 74881:76321, ack 1, win 32768, options [TS val 2041 ecr 2036,eol], length 1440: HTTP
2.047047 IP 100.1.2.1.8080 > 1.1.2.1.49153: Flags [.], ack 76321, win 32768, options [TS val 2047 ecr 2041,eol], length 0
2.047166 IP 1.1.2.1.49153 > 100.1.2.1.8080: Flags [.], seq 76321:77761, ack 1, win 32768, options [TS val 2041 ecr 2036,eol], length 1440: HTTP
2.047410 IP 1.1.2.1.49153 > 100.1.2.1.8080: Flags [.], seq 77761:79201, ack 1, win 32768, options [TS val 2041 ecr 2036,eol], length 1440: HTTP
2.047410 IP 100.1.2.1.8080 > 1.1.2.1.49153: Flags [.], ack 79201, win 32768, options [TS val 2047 ecr 2041,eol], length 0
2.047650 IP 1.1.2.1.49153 > 100.1.2.1.8080: Flags [.], seq 79201:80641, ack 1, win 32768, options [TS val 2041 ecr 2036,eol], length 1440: HTTP
2.047773 IP 1.1.2.1.49153 > 100.1.2.1.8080: Flags [.], seq 80641:82081, ack 1, win 32768, options [TS val 2041 ecr 2036,eol], length 1440: HTTP
2.047773 IP 100.1.2.1.8080 > 1.1.2.1.49153: Flags [.], ack 82081, win 32768, options [TS val 2047 ecr 2041,eol], length 0
2.047893 IP 1.1.2.1.49153 > 100.1.2.1.8080: Flags [.], seq 82081:83521, ack 1, win 32768, options [TS val 2041 ecr 2036,eol], length 1440: HTTP
2.048136 IP 1.1.2.1.49153 > 100.1.2.1.8080: Flags [.], seq 83521:84961, ack 1, win 32768, options [TS val 2041 ecr 2036,eol], length 1440: HTTP
2.048136 IP 100.1.2.1.8080 > 1.1.2.1.49153: Flags [.], ack 84961, win 32768, options [TS val 2048 ecr 2041,eol], length 0
2.048256 IP 1.1.2.1.49153 > 100.1.2.1.8080: Flags [.], seq 84961:86401, ack 1, win 32768, options [TS val 2041 ecr 2036,eol], length 1440: HTTP
2.048624 IP 1.1.2.1.49153 > 100.1.2.1.8080: Flags [.], seq 86401:87841, ack 1, win 32768, options [TS val 2042 ecr 2037,eol], length 1440: HTTP
2.048624 IP 100.1.2.1.8080 > 1.1.2.1.49153: Flags [.], ack 87841, win 32768, options [TS val 2048 ecr 2041,eol], length 0
2.048743 IP 1.1.2.1.49153 > 100.1.2.1.8080: Flags [.], seq 87841:89281, ack 1, win 32768, options [TS val 2042 ecr 2037,eol], length 1440: HTTP
2.048863 IP 1.1.2.1.49153 > 100.1.2.1.8080: Flags [.], seq 89281:90721, ack 1, win 32768, options [TS val 2042 ecr 2037,eol], length 1440: HTTP
2.048863 IP 100.1.2.1.8080 > 1.1.2.1.49153: Flags [.], ack 90721, win 32768, options [TS val 2048 ecr 2042,eol], length 0
2.049106 IP 1.1.2.1.49153 > 100.1.2.1.8080: Flags [.], seq 90721:92161, ack 1, win 32768, options [TS val 2042 ecr 2037,eol], length 1440: HTTP
2.049226 IP 1.1.2.1.49153 > 100.1.2.1.8080: Flags [.], seq 92161:93601, ack 1, win 32768, options [TS val 2042 ecr 2037,eol], length 1440: HTTP
2.049226 IP 100.1.2.1.8080 > 1.1.2.1.49153: Flags [.], ack 93601, win 32768, options [TS val 2049 ecr 2042,eol], length 0
2.049346 IP 1.1.2.1.49153 > 100.1.2.1.8080: Flags [.], seq 93601:95041, ack 1, win 32768, options [TS val 2042 ecr 2037,eol], length 1440: HTTP
2.049589 IP 1.1.2.1.49153 > 100.1.2.1.8080: Flags [.], seq 95041:96481, ack 1, win 32768, options [TS val 2042 ecr 2037,eol], length 1440: HTTP
2.049589 IP 100.1.2.1.8080 > 1.1.2.1.49153: Flags [.], ack 96481, win 32768, options [TS val 2049 ecr 2042,eol], length 0
2.049709 IP 1.1.2.1.49153 > 100.1.2.1.8080: Flags [.], seq 96481:97921, ack 1, win 32768, options [TS val 2042 ecr 2037,eol], length 1440: HTTP
2.049828 IP 1.1.2.1.49153 > 100.1.2.1.8080: Flags [.], seq 97921:99361, ack 1, win 32768, options [TS val 2042 ecr 2037,eol], length 1440: HTTP
2.049828 IP 100.1.2.1.8080 > 1.1.2.1.49153: Flags [.], ack 99361, win 32768, options [TS val 2049 ecr 2042,eol], length 0
2.050196 IP 1.1.2.1.49153 > 100.1.2.1.8080: Flags [.], seq 99361:100801, ack 1, win 32768, options [TS val 2043 ecr 2038,eol], length 1440: HTTP
2.050316 IP 1.1.2.1.49153 > 100.1.2.1.8080: Flags [.], seq 100801:102241, ack 1, win 32768, options [TS val 2043 ecr 2038,eol], length 1440: HTTP
2.050316 IP 100.1.2.1.8080 > 1.1.2.1.49153: Flags [.], ack 102241, win 32768, options [TS val 2050 ecr 2043,eol], length 0
2.050435 IP 1.1.2.1.49153 > 100.1.2.1.8080: Flags [.], seq 102241:103681, ack 1, win 32768, options [TS val 2043 ecr 2038,eol], length 1440: HTTP
2.050803 IP 1.1.2.1.49153 > 100.1.2.1.8080: Flags [.], seq 103681:105121, ack 1, win 32768, options [TS val 2043 ecr 2038,eol], length 1440: HTTP
2.050803 IP 100.1.2.1.8080 > 1.1.2.1.49153: Flags [.], ack 105121, win 32768, options [TS val 2050 ecr 2043,eol], length 0
2.050922 IP 1.1.2.1.49153 > 100.1.2.1.8080: Flags [.], seq 105121:106561, ack 1, win 32768, options [TS val 2043 ecr 2038,eol], length 1440: HTTP
2.051042 IP 1.1.2.1.49153 > 100.1.2.1.8080: Flags [.], seq 106561:108001, ack 1, win 32768, options [TS val 2043 ecr 2038,eol], length 1440: HTTP
2.051042 IP 100.1.2.1.8080 > 1.1.2.1.49153: Flags [.], ack 108001, win 32768, options [TS val 2051 ecr 2043,eol], length 0
2.051286 IP 1.1.2.1.49153 > 100.1.2.1.8080: Flags [.], seq 108001:109441, ack 1, win 32768, options [TS val 2044 ecr 2039,eol], length 1440: HTTP
2.051405 IP 1.1.2.1.49153 > 100.1.2.1.8080: Flags [.], seq 109441:110881, ack 1, win 32768, options [TS val 2044 ecr 2039,eol], length 1440: HTTP
2.051405 IP 100.1.2.1.8080 > 1.1.2.1.49153: Flags [.], ack 110881, win 32768, options [TS val 2051 ecr 2044,eol], length 0
2.051525 IP 1.1.2.1.49153 > 100.1.2.1.8080: Flags [.], seq 110881:112321, ack 1, win 32768, options [TS val 2044 ecr 2039,eol], length 1440: HTTP
2.056106 IP 1.1.2.1.49153 > 100.1.2.1.8080: Flags [.], seq 112321:113761, ack 1, win 32768, options [TS val 2050 ecr 2045,eol], length 1440: HTTP
2.056106 IP 100.1.2.1.8080 > 1.1.2.1.49153: Flags [.], ack 113761, win 32768, options [TS val 2056 ecr 2044,eol], length 0
2.056225 IP 1.1.2.1.49153 > 100.1.2.1.8080: Flags [.], seq 113761:115201, ack 1, win 32768, options [TS val 2050 ecr 2045,eol], length 1440: HTTP
2.056345 IP 1.1.2.1.49153 > 100.1.2.1.8080: Flags [.], seq 115201:116641, ack 1, win 32768, options [TS val 2050 ecr 2045,eol], length 1440: HTTP
2.056345 IP 100.1.2.1.8080 > 1.1.2.1.49153: Flags [.], ack 116641, win 32768, options [TS val 2056 ecr 2050,eol], length 0
2.056713 IP 1.1.2.1.49153 > 100.1.2.1.8080: Flags [.], seq 116641:118081, ack 1, win 32768, options [TS val 2051 ecr 2046,eol], length 1440: HTTP
2.056832 IP 1.1.2.1.49153 > 100.1.2.1.8080: Flags [.], seq 118081:119521, ack 1, win 32768, options [TS val 2051 ecr 2046,eol], length 1440: HTTP
2.056832 IP 100.1.2.1.8080 > 1.1.2.1.49153: Flags [.], ack 119521, win 32768, options [TS val 2056 ecr 2051,eol], length 0
2.056952 IP 1.1.2.1.49153 > 100.1.2.1.8080: Flags [.], seq 119521:120961, ack 1, win 32768, options [TS val 2051 ecr 2046,eol], length 1440: HTTP
2.057195 IP 1.1.2.1.49153 > 100.1.2.1.8080: Flags [.], seq 120961:122401, ack 1, win 32768, options [TS val 2051 ecr 2046,eol], length 1440: HTTP
2.057195 IP 100.1.2.1.8080 > 1.1.2.1.49153: Flags [.], ack 122401, win 32768, options [TS val 2057 ecr 2051,eol], length 0
2.057315 IP 1.1.2.1.49153 > 100.1.2.1.8080: Flags [.], seq 122401:123841, ack 1, win 32768, options [TS val 2051 ecr 2046,eol], length 1440: HTTP
2.057434 IP 1.1.2.1.49153 > 100.1.2.1.8080: Flags [.], seq 123841:125281, ack 1, win 32768, options [TS val 2051 ecr 2046,eol], length 1440: HTTP
2.057434 IP 100.1.2.1.8080 > 1.1.2.1.49153: Flags [.], ack 125281, win 32768, options [TS val 2057 ecr 2051,eol], length 0
2.057802 IP 1.1.2.1.49153 > 100.1.2.1.8080: Flags [.], seq 125281:126721, ack 1, win 32768, options [TS val 2052 ecr 2047,eol], length 1440: HTTP
2.057922 IP 1.1.2.1.49153 > 100.1.2.1.8080: Flags [.], seq 126721:128161, ack 1, win 32768, options [TS val 2052 ecr 2047,eol], length 1440: HTTP
2.057922 IP 100.1.2.1.8080 > 1.1.2.1.49153: Flags [.], ack 128161, win 32768, options [TS val 2057 ecr 2052,eol], length 0
2.058041 IP 1.1.2.1.49153 > 100.1.2.1.8080: Flags [.], seq 128161:129601, ack 1, win 32768, options [TS val 2052 ecr 2047,eol], length 1440: HTTP
2.058285 IP 1.1.2.1.49153 > 100.1.2.1.8080: Flags [.], seq 129601:131041, ack 1, win 32768, options [TS val 2052 ecr 2047,eol], length 1440: HTTP
2.058285 IP 100.1.2.1.8080 > 1.1.2.1.49153: Flags [.], ack 131041, win 32768, options [TS val 2058 ecr 2052,eol], length 0
2.058405 IP 1.1.2.1.49153 > 100.1.2.1.8080: Flags [.], seq 131041:132481, ack 1, win 32768, options [TS val 2052 ecr 2047,eol], length 1440: HTTP
2.058524 IP 1.1.2.1.49153 > 100.1.2.1.8080: Flags [.], seq 132481:133921, ack 1, win 32768, options [TS val 2052 ecr 2047,eol], length 1440: HTTP
2.058524 IP 100.1.2.1.8080 > 1.1.2.1.49153: Flags [.], ack 133921, win 32768, options [TS val 2058 ecr 2052,eol], length 0
2.058892 IP 1.1.2.1.49153 > 100.1.2.1.8080: Flags [.], seq 133921:135361, ack 1, win 32768, options [TS val 2052 ecr 2047,eol], length 1440: HTTP
2.059011 IP 1.1.2.1.49153 > 100.1.2.1.8080: Flags [.], seq 135361:136801, ack 1, win 32768, options [TS val 2052 ecr 2047,eol], length 1440: HTTP
2.059011 IP 100.1.2.1.8080 > 1.1.2.1.49153: Flags [.], ack 136801, win 32768, options [TS val 2059 ecr 2052,eol], length 0
2.059131 IP 1.1.2.1.49153 > 100.1.2.1.8080: Flags [.], seq 136801:138241, ack 1, win 32768, options [TS val 2052 ecr 2047,eol], length 1440: HTTP
2.059375 IP 1.1.2.1.49153 > 100.1.2.1.8080: Flags [.], seq 138241:139681, ack 1, win 32768, options [TS val 2053 ecr 2048,eol], length 1440: HTTP
2.059375 IP 100.1.2.1.8080 > 1.1.2.1.49153: Flags [.], ack 139681, win 32768, options [TS val 2059 ecr 2052,eol], length 0
2.059494 IP 1.1.2.1.49153 > 100.1.2.1.8080: Flags [.], seq 139681:141121, ack 1, win 32768, options [TS val 2053 ecr 2048,eol], length 1440: HTTP
2.059738 IP 1.1.2.1.49153 > 100.1.2.1.8080: Flags [.], seq 141121:142561, ack 1, win 32768, options [TS val 2053 ecr 2048,eol], length 1440: HTTP
2.059738 IP 100.1.2.1.8080 > 1.1.2.1.49153: Flags [.], ack 142561, win 32768, options [TS val 2059 ecr 2053,eol], length 0
2.060106 IP 1.1.2.1.49153 > 100.1.2.1.8080: Flags [.], seq 142561:144001, ack 1, win 32768, options [TS val 2053 ecr 2048,eol], length 1440: HTTP
2.060225 IP 1.1.2.1.49153 > 100.1.2.1.8080: Flags [.], seq 144001:145441, ack 1, win 32768, options [TS val 2053 ecr 2048,eol], length 1440: HTTP
2.060225 IP 100.1.2.1.8080 > 1.1.2.1.49153: Flags [.], ack 145441, win 32768, options [TS val 2060 ecr 2053,eol], length 0
2.060345 IP 1.1.2.1.49153 > 100.1.2.1.8080: Flags [.], seq 145441:146881, ack 1, win 32768, options [TS val 2053 ecr 2048,eol], length 1440: HTTP
2.060588 IP 1.1.2.1.49153 > 100.1.2.1.8080: Flags [.], seq 146881:148321, ack 1, win 32768, options [TS val 2053 ecr 2048,eol], length 1440: HTTP
2.060588 IP 100.1.2.1.8080 > 1.1.2.1.49153: Flags [.], ack 148321, win 32768, options [TS val 2060 ecr 2053,eol], length 0
2.060708 IP 1.1.2.1.49153 > 100.1.2.1.8080: Flags [.], seq 148321:149761, ack 1, win 32768, options [TS val 2053 ecr 2048,eol], length 1440: HTTP
2.060827 IP 1.1.2.1.49153 > 100.1.2.1.8080: Flags [.], seq 149761:151201, ack 1, win 32768, options [TS val 2053 ecr 2048,eol], length 1440: HTTP
2.060827 IP 100.1.2.1.8080 > 1.1.2.1.49153: Flags [.], ack 151201, win 32768, options [TS val 2060 ecr 2053,eol], length 0
2.061071 IP 1.1.2.1.49153 > 100.1.2.1.8080: Flags [.], seq 151201:152641, ack 1, win 32768, options [TS val 2054 ecr 2049,eol], length 1440: HTTP
2.061191 IP 1.1.2.1.49153 > 100.1.2.1.8080: Flags [.], seq 152641:154081, ack 1, win 32768, options [TS val 2054 ecr 2049,eol], length 1440: HTTP
2.061191 IP 100.1.2.1.8080 > 1.1.2.1.49153: Flags [.], ack 154081, win 32768, options [TS val 2061 ecr 2054,eol], length 0
2.061310 IP 1.1.2.1.49153 > 100.1.2.1.8080: Flags [.], seq 154081:155521, ack 1, win 32768, options [TS val 2054 ecr 2049,eol], length 1440: HTTP
2.061678 IP 1.1.2.1.49153 > 100.1.2.1.8080: Flags [.], seq 155521:156961, ack 1, win 32768, options [TS val 2054 ecr 2049,eol], length 1440: HTTP
2.061678 IP 100.1.2.1.8080 > 1.1.2.1.49153: Flags [.], ack 156961, win 32768, options [TS val 2061 ecr 2054,eol], length 0
2.061797 IP 1.1.2.1.49153 > 100.1.2.1.8080: Flags [.], seq 156961:158401, ack 1, win 32768, options [TS val 2054 ecr 2049,eol], length 1440: HTTP
2.061917 IP 1.1.2.1.49153 > 100.1.2.1.8080: Flags [.], seq 158401:159841, ack 1, win 32768, options [TS val 2054 ecr 2049,eol], length 1440: HTTP
2.061917 IP 100.1.2.1.8080 > 1.1.2.1.49153: Flags [.], ack 159841, win 32768, options [TS val 2061 ecr 2054,eol], length 0
2.062161 IP 1.1.2.1.49153 > 100.1.2.1.8080: Flags [.], seq 159841:161281, ack 1, win 32768, options [TS val 2054 ecr 2049,eol], length 1440: HTTP
2.062280 IP 1.1.2.1.49153 > 100.1.2.1.8080: Flags [.], seq 161281:162721, ack 1, win 32768, options [TS val 2054 ecr 2049,eol], length 1440: HTTP
2.062280 IP 100.1.2.1.8080 > 1.1.2.1.49153: Flags [.], ack 162721, win 32768, options [TS val 2062 ecr 2054,eol], length 0
2.062400 IP 1.1.2.1.49153 > 100.1.2.1.8080: Flags [.], seq 162721:164161, ack 1, win 32768, options [TS val 2054 ecr 2049,eol], length 1440: HTTP
2.062768 IP 1.1.2.1.49153 > 100.1.2.1.8080: Flags [.], seq 164161:165601, ack 1, win 32768, options [TS val 2055 ecr 2050,eol], length 1440: HTTP
2.062768 IP 100.1.2.1.8080 > 1.1.2.1.49153: Flags [.], ack 165601, win 32768, options [TS val 2062 ecr 2054,eol], length 0
2.062887 IP 1.1.2.1.49153 > 100.1.2.1.8080: Flags [.], seq 165601:167041, ack 1, win 32768, options [TS val 2055 ecr 2050,eol], length 1440: HTTP
2.063007 IP 1.1.2.1.49153 > 100.1.2.1.8080: Flags [.], seq 167041:168481, ack 1, win 32768, options [TS val 2055 ecr 2050,eol], length 1440: HTTP
2.063007 IP 100.1.2.1.8080 > 1.1.2.1.49153: Flags [.], ack 168481, win 32768, options [TS val 2063 ecr 2055,eol], length 0
2.063374 IP 1.1.2.1.49153 > 100.1.2.1.8080: Flags [.], seq 168481:169921, ack 1, win 32768, options [TS val 2055 ecr 2050,eol], length 1440: HTTP
2.063494 IP 1.1.2.1.49153 > 100.1.2.1.8080: Flags [.], seq 169921:171361, ack 1, win 32768, options [TS val 2055 ecr 2050,eol], length 1440: HTTP
2.063494 IP 100.1.2.1.8080 > 1.1.2.1.49153: Flags [.], ack 171361, win 32768, options [TS val 2063 ecr 2055,eol], length 0
2.063613 IP 1.1.2.1.49153 > 100.1.2.1.8080: Flags [.], seq 171361:172801, ack 1, win 32768, options [TS val 2055 ecr 2050,eol], length 1440: HTTP
2.063857 IP 1.1.2.1.49153 > 100.1.2.1.8080: Flags [.], seq 172801:174241, ack 1, win 32768, options [TS val 2056 ecr 2051,eol], length 1440: HTTP
2.063857 IP 100.1.2.1.8080 > 1.1.2.1.49153: Flags [.], ack 174241, win 32768, options [TS val 2063 ecr 2055,eol], length 0
2.063977 IP 1.1.2.1.49153 > 100.1.2.1.8080: Flags [.], seq 174241:175681, ack 1, win 32768, options [TS val 2056 ecr 2051,eol], length 1440: HTTP
2.064096 IP 1.1.2.1.49153 > 100.1.2.1.8080: Flags [.], seq 175681:177121, ack 1, win 32768, options [TS val 2056 ecr 2051,eol], length 1440: HTTP
2.064096 IP 100.1.2.1.8080 > 1.1.2.1.49153: Flags [.], ack 177121, win 32768, options [TS val 2064 ecr 2056,eol], length 0
2.064340 IP 1.1.2.1.49153 > 100.1.2.1.8080: Flags [.], seq 177121:178561, ack 1, win 32768, options [TS val 2056 ecr 2051,eol], length 1440: HTTP
2.064459 IP 1.1.2.1.49153 > 100.1.2.1.8080: Flags [.], seq 178561:180001, ack 1, win 32768, options [TS val 2056 ecr 2051,eol], length 1440: HTTP
2.064459 IP 100.1.2.1.8080 > 1.1.2.1.49153: Flags [.], ack 180001, win 32768, options [TS val 2064 ecr 2056,eol], length 0
2.064579 IP 1.1.2.1.49153 > 100.1.2.1.8080: Flags [.], seq 180001:181441, ack 1, win 32768, options [TS val 2056 ecr 2051,eol], length 1440: HTTP
2.067182 IP 1.1.2.1.49153 > 100.1.2.1.8080: Flags [.], seq 181441:182881, ack 1, win 32768, options [TS val 2061 ecr 2056,eol], length 1440: HTTP
2.067182 IP 100.1.2.1.8080 > 1.1.2.1.49153: Flags [.], ack 182881, win 32768, options [TS val 2067 ecr 2056,eol], length 0
2.067301 IP 1.1.2.1.49153 > 100.1.2.1.8080: Flags [.], seq 182881:184321, ack 1, win 32768, options [TS val 2061 ecr 2056,eol], length 1440: HTTP
2.067545 IP 1.1.2.1.49153 > 100.1.2.1.8080: Flags [.], seq 184321:185761, ack 1, win 32768, options [TS val 2061 ecr 2056,eol], length 1440: HTTP
2.067545 IP 100.1.2.1.8080 > 1.1.2.1.49153: Flags [.], ack 185761, win 32768, options [TS val 2067 ecr 2061,eol], length 0
2.067664 IP 1.1.2.1.49153 > 100.1.2.1.8080: Flags [.], seq 185761:187201, ack 1, win 32768, options [TS val 2061 ecr 2056,eol], length 1440: HTTP
2.067908 IP 1.1.2.1.49153 > 100.1.2.1.8080: Flags [.], seq 187201:188641, ack 1, win 32768, options [TS val 2061 ecr 2056,eol], length 1440: HTTP
2.067908 IP 100.1.2.1.8080 > 1.1.2.1.49153: Flags [.], ack 188641, win 32768, options [TS val 2067 ecr 2061,eol], length 0
2.068028 IP 1.1.2.1.49153 > 100.1.2.1.8080: Flags [.], seq 188641:190081, ack 1, win 32768, options [TS val 2061 ecr 2056,eol], length 1440: HTTP
2.068395 IP 1.1.2.1.49153 > 100.1.2.1.8080: Flags [.], seq 190081:191521, ack 1, win 32768, options [TS val 2061 ecr 2056,eol], length 1440: HTTP
2.068395 IP 100.1.2.1.8080 > 1.1.2.1.49153: Flags [.], ack 191521, win 32768, options [TS val 2068 ecr 2061,eol], length 0
2.068515 IP 1.1.2.1.49153 > 100.1.2.1.8080: Flags [.], seq 191521:192961, ack 1, win 32768, options [TS val 2061 ecr 2056,eol], length 1440: HTTP
2.068634 IP 1.1.2.1.49153 > 100.1.2.1.8080: Flags [.], seq 192961:194401, ack 1, win 32768, options [TS val 2061 ecr 2056,eol], length 1440: HTTP
2.068634 IP 100.1.2.1.8080 > 1.1.2.1.49153: Flags [.], ack 194401, win 32768, options [TS val 2068 ecr 2061,eol], length 0
2.068878 IP 1.1.2.1.49153 > 100.1.2.1.8080: Flags [.], seq 194401:195841, ack 1, win 32768, options [TS val 2062 ecr 2057,eol], length 1440: HTTP
2.068998 IP 1.1.2.1.49153 > 100.1.2.1.8080: Flags [.], seq 195841:197281, ack 1, win 32768, options [TS val 2062 ecr 2057,eol], length 1440: HTTP
2.068998 IP 100.1.2.1.8080 > 1.1.2.1.49153: Flags [.], ack 197281, win 32768, options [TS val 2068 ecr 2062,eol], length 0
2.069117 IP 1.1.2.1.49153 > 100.1.2.1.8080: Flags [.], seq 197281:198721, ack 1, win 32768, options [TS val 2062 ecr 2057,eol], length 1440: HTTP
2.069361 IP 1.1.2.1.49153 > 100.1.2.1.8080: Flags [.], seq 198721:200161, ack 1, win 32768, options [TS val 2062 ecr 2057,eol], length 1440: HTTP
2.069361 IP 100.1.2.1.8080 > 1.1.2.1.49153: Flags [.], ack 200161, win 32768, options [TS val 2069 ecr 2062,eol], length 0
2.069480 IP 1.1.2.1.49153 > 100.1.2.1.8080: Flags [.], seq 200161:201601, ack 1, win 32768, options [TS val 2062 ecr 2057,eol], length 1440: HTTP
2.069600 IP 1.1.2.1.49153 > 100.1.2.1.8080: Flags [.], seq 201601:203041, ack 1, win 32768, options [TS val 2062 ecr 2057,eol], length 1440: HTTP
2.069600 IP 100.1.2.1.8080 > 1.1.2.1.49153: Flags [.], ack 203041, win 32768, options [TS val 2069 ecr 2062,eol], length 0
2.069968 IP 1.1.2.1.49153 > 100.1.2.1.8080: Flags [.], seq 203041:204481, ack 1, win 32768, options [TS val 2062 ecr 2057,eol], length 1440: HTTP
2.070087 IP 1.1.2.1.49153 > 100.1.2.1.8080: Flags [.], seq 204481:205921, ack 1, win 32768, options [TS val 2062 ecr 2057,eol], length 1440: HTTP
2.070087 IP 100.1.2.1.8080 > 1.1.2.1.49153: Flags [.], ack 205921, win 32768, options [TS val 2070 ecr 2062,eol], length 0
2.070207 IP 1.1.2.1.49153 > 100.1.2.1.8080: Flags [.], seq 205921:207361, ack 1, win 32768, options [TS val 2062 ecr 2057,eol], length 1440: HTTP
2.070575 IP 1.1.2.1.49153 > 100.1.2.1.8080: Flags [.], seq 207361:208801, ack 1, win 32768, options [TS val 2063 ecr 2058,eol], length 1440: HTTP
2.070575 IP 100.1.2.1.8080 > 1.1.2.1.49153: Flags [.], ack 208801, win 32768, options [TS val 2070 ecr 2062,eol], length 0
2.070694 IP 1.1.2.1.49153 > 100.1.2.1.8080: Flags [.], seq 208801:210241, ack 1, win 32768, options [TS val 2063 ecr 2058,eol], length 1440: HTTP
2.070814 IP 1.1.2.1.49153 > 100.1.2.1.8080: Flags [.], seq 210241:211681, ack 1, win 32768, options [TS val 2063 ecr 2058,eol], length 1440: HTTP
2.070814 IP 100.1.2.1.8080 > 1.1.2.1.49153: Flags [.], ack 211681, win 32768, options [TS val 2070 ecr 2063,eol], length 0
2.071057 IP 1.1.2.1.49153 > 100.1.2.1.8080: Flags [.], seq 211681:213121, ack 1, win 32768, options [TS val 2063 ecr 2058,eol], length 1440: HTTP
2.071177 IP 1.1.2.1.49153 > 100.1.2.1.8080: Flags [.], seq 213121:214561, ack 1, win 32768, options [TS val 2063 ecr 2058,eol], length 1440: HTTP
2.071177 IP 100.1.2.1.8080 > 1.1.2.1.49153: Flags [.], ack 214561, win 32768, options [TS val 2071 ecr 2063,eol], length 0
2.071296 IP 1.1.2.1.49153 > 100.1.2.1.8080: Flags [.], seq 214561:216001, ack 1, win 32768, options [TS val 2063 ecr 2058,eol], length 1440: HTTP
2.071664 IP 1.1.2.1.49153 > 100.1.2.1.8080: Flags [.], seq 216001:217441, ack 1, win 32768, options [TS val 2064 ecr 2059,eol], length 1440: HTTP
2.071664 IP 100.1.2.1.8080 > 1.1.2.1.49153: Flags [.], ack 217441, win 32768, options [TS val 2071 ecr 2063,eol], length 0
2.071784 IP 1.1.2.1.49153 > 100.1.2.1.8080: Flags [.], seq 217441:218881, ack 1, win 32768, options [TS val 2064 ecr 2059,eol], length 1440: HTTP
2.071903 IP 1.1.2.1.49153 > 100.1.2.1.8080: Flags [.], seq 218881:220321, ack 1, win 32768, options [TS val 2064 ecr 2059,eol], length 1440: HTTP
2.071903 IP 100.1.2.1.8080 > 1.1.2.1.49153: Flags [.], ack 220321, win 32768, options [TS val 2071 ecr 2064,eol], length 0
2.072147 IP 1.1.2.1.49153 > 100.1.2.1.8080: Flags [.], seq 220321:221761, ack 1, win 32768, options [TS val 2064 ecr 2059,eol], length 1440: HTTP
2.072266 IP 1.1.2.1.49153 > 100.1.2.1.8080: Flags [.], seq 221761:223201, ack 1, win 32768, options [TS val 2064 ecr 2059,eol], length 1440: HTTP
2.072266 IP 100.1.2.1.8080 > 1.1.2.1.49153: Flags [.], ack 223201, win 32768, options [TS val 2072 ecr 2064,eol], length 0
2.072386 IP 1.1.2.1.49153 > 100.1.2.1.8080: Flags [.], seq 223201:224641, ack 1, win 32768, options [TS val 2064 ecr 2059,eol], length 1440: HTTP
2.072754 IP 1.1.2.1.49153 > 100.1.2.1.8080: Flags [.], seq 224641:226081, ack 1, win 32768, options [TS val 2064 ecr 2059,eol], length 1440: HTTP
2.072754 IP 100.1.2.1.8080 > 1.1.2.1.49153: Flags [.], ack 226081, win 32768, options [TS val 2072 ecr 2064,eol], length 0
2.072873 IP 1.1.2.1.49153 > 100.1.2.1.8080: Flags [.], seq 226081:227521, ack 1, win 32768, options [TS val 2064 ecr 2059,eol], length 1440: HTTP
2.072993 IP 1.1.2.1.49153 > 100.1.2.1.8080: Flags [.], seq 227521:228961, ack 1, win 32768, options [TS val 2064 ecr 2059,eol], length 1440: HTTP
2.072993 IP 100.1.2.1.8080 > 1.1.2.1.49153: Flags [.], ack 228961, win 32768, options [TS val 2072 ecr 2064,eol], length 0
2.073361 IP 1.1.2.1.49153 > 100.1.2.1.8080: Flags [.], seq 228961:230401, ack 1, win 32768, options [TS val 2065 ecr 2060,eol], length 1440: HTTP
2.073480 IP 1.1.2.1.49153 > 100.1.2.1.8080: Flags [.], seq 230401:231841, ack 1, win 32768, options [TS val 2065 ecr 2060,eol], length 1440: HTTP
2.073480 IP 100.1.2.1.8080 > 1.1.2.1.49153: Flags [.], ack 231841, win 32768, options [TS val 2073 ecr 2065,eol], length 0
2.073600 IP 1.1.2.1.49153 > 100.1.2.1.8080: Flags [.], seq 231841:233281, ack 1, win 32768, options [TS val 2065 ecr 2060,eol], length 1440: HTTP
2.073968 IP 1.1.2.1.49153 > 100.1.2.1.8080: Flags [.], seq 233281:234721, ack 1, win 32768, options [TS val 2065 ecr 2060,eol], length 1440: HTTP
2.073968 IP 100.1.2.1.8080 > 1.1.2.1.49153: Flags [.], ack 234721, win 32768, options [TS val 2073 ecr 2065,eol], length 0
2.074087 IP 1.1.2.1.49153 > 100.1.2.1.8080: Flags [.], seq 234721:236161, ack 1, win 32768, options [TS val 2065 ecr 2060,eol], length 1440: HTTP
2.074207 IP 1.1.2.1.49153 > 100.1.2.1.8080: Flags [.], seq 236161:237601, ack 1, win 32768, options [TS val 2065 ecr 2060,eol], length 1440: HTTP
2.074207 IP 100.1.2.1.8080 > 1.1.2.1.49153: Flags [.], ack 237601, win 32768, options [TS val 2074 ecr 2065,eol], length 0
2.074450 IP 1.1.2.1.49153 > 100.1.2.1.8080: Flags [.], seq 237601:239041, ack 1, win 32768, options [TS val 2065 ecr 2060,eol], length 1440: HTTP
2.074570 IP 1.1.2.1.49153 > 100.1.2.1.8080: Flags [.], seq 239041:240481, ack 1, win 32768, options [TS val 2065 ecr 2060,eol], length 1440: HTTP
2.074570 IP 100.1.2.1.8080 > 1.1.2.1.49153: Flags [.], ack 240481, win 32768, options [TS val 2074 ecr 2065,eol], length 0
2.074689 IP 1.1.2.1.49153 > 100.1.2.1.8080: Flags [.], seq 240481:241921, ack 1, win 32768, options [TS val 2065 ecr 2060,eol], length 1440: HTTP
2.074933 IP 1.1.2.1.49153 > 100.1.2.1.8080: Flags [.], seq 241921:243361, ack 1, win 32768, options [TS val 2066 ecr 2061,eol], length 1440: HTTP
2.074933 IP 100.1.2.1.8080 > 1.1.2.1.49153: Flags [.], ack 243361, win 32768, options [TS val 2074 ecr 2065,eol], length 0
2.075053 IP 1.1.2.1.49153 > 100.1.2.1.8080: Flags [.], seq 243361:244801, ack 1, win 32768, options [TS val 2066 ecr 2061,eol], length 1440: HTTP
2.075172 IP 1.1.2.1.49153 > 100.1.2.1.8080: Flags [.], seq 244801:246241, ack 1, win 32768, options [TS val 2066 ecr 2061,eol], length 1440: HTTP
2.075172 IP 100.1.2.1.8080 > 1.1.2.1.49153: Flags [.], ack 246241, win 32768, options [TS val 2075 ecr 2066,eol], length 0
2.075540 IP 1.1.2.1.49153 > 100.1.2.1.8080: Flags [.], seq 246241:247681, ack 1, win 32768, options [TS val 2066 ecr 2061,eol], length 1440: HTTP
2.075659 IP 1.1.2.1.49153 > 100.1.2.1.8080: Flags [.], seq 247681:249121, ack 1, win 32768, options [TS val 2066 ecr 2061,eol], length 1440: HTTP
2.075659 IP 100.1.2.1.8080 > 1.1.2.1.49153: Flags [.], ack 249121, win 32768, options [TS val 2075 ecr 2066,eol], length 0
2.075779 IP 1.1.2.1.49153 > 100.1.2.1.8080: Flags [.], seq 249121:250561, ack 1, win 32768, options [TS val 2066 ecr 2061,eol], length 1440: HTTP
2.076023 IP 1.1.2.1.49153 > 100.1.2.1.8080: Flags [.], seq 250561:252001, ack 1, win 32768, options [TS val 2066 ecr 2061,eol], length 1440: HTTP
2.076023 IP 100.1.2.1.8080 > 1.1.2.1.49153: Flags [.], ack 252001, win 32768, options [TS val 2076 ecr 2066,eol], length 0
2.076142 IP 1.1.2.1.49153 > 100.1.2.1.8080: Flags [.], seq 252001:253441, ack 1, win 32768, options [TS val 2066 ecr 2061,eol], length 1440: HTTP
2.076262 IP 1.1.2.1.49153 > 100.1.2.1.8080: Flags [.], seq 253441:254881, ack 1, win 32768, options [TS val 2066 ecr 2061,eol], length 1440: HTTP
2.076262 IP 100.1.2.1.8080 > 1.1.2.1.49153: Flags [.], ack 254881, win 32768, options [TS val 2076 ecr 2066,eol], length 0
2.076629 IP 1.1.2.1.49153 > 100.1.2.1.8080: Flags [.], seq 254881:256321, ack 1, win 32768, options [TS val 2067 ecr 2062,eol], length 1440: HTTP
2.076749 IP 1.1.2.1.49153 > 100.1.2.1.8080: Flags [.], seq 256321:257761, ack 1, win 32768, options [TS val 2067 ecr 2062,eol], length 1440: HTTP
2.076749 IP 100.1.2.1.8080 > 1.1.2.1.49153: Flags [.], ack 257761, win 32768, options [TS val 2076 ecr 2067,eol], length 0
2.076869 IP 1.1.2.1.49153 > 100.1.2.1.8080: Flags [.], seq 257761:259201, ack 1, win 32768, options [TS val 2067 ecr 2062,eol], length 1440: HTTP
2.077236 IP 1.1.2.1.49153 > 100.1.2.1.8080: Flags [.], seq 259201:260641, ack 1, win 32768, options [TS val 2067 ecr 2062,eol], length 1440: HTTP
2.077236 IP 100.1.2.1.8080 > 1.1.2.1.49153: Flags [.], ack 260641, win 32768, options [TS val 2077 ecr 2067,eol], length 0
2.077356 IP 1.1.2.1.49153 > 100.1.2.1.8080: Flags [.], seq 260641:262081, ack 1, win 32768, options [TS val 2067 ecr 2062,eol], length 1440: HTTP
2.077475 IP 1.1.2.1.49153 > 100.1.2.1.8080: Flags [.], seq 262081:263521, ack 1, win 32768, options [TS val 2067 ecr 2062,eol], length 1440: HTTP
2.077475 IP 100.1.2.1.8080 > 1.1.2.1.49153: Flags [.], ack 263521, win 32768, options [TS val 2077 ecr 2067,eol], length 0
2.077719 IP 1.1.2.1.49153 > 100.1.2.1.8080: Flags [.], seq 263521:264961, ack 1, win 32768, options [TS val 2068 ecr 2063,eol], length 1440: HTTP
2.077839 IP 1.1.2.1.49153 > 100.1.2.1.8080: Flags [.], seq 264961:266401, ack 1, win 32768, options [TS val 2068 ecr 2063,eol], length 1440: HTTP
2.077839 IP 100.1.2.1.8080 > 1.1.2.1.49153: Flags [.], ack 266401, win 32768, options [TS val 2077 ecr 2068,eol], length 0
2.077958 IP 1.1.2.1.49153 > 100.1.2.1.8080: Flags [.], seq 266401:267841, ack 1, win 32768, options [TS val 2068 ecr 2063,eol], length 1440: HTTP
2.078326 IP 1.1.2.1.49153 > 100.1.2.1.8080: Flags [.], seq 267841:269281, ack 1, win 32768, options [TS val 2068 ecr 2063,eol], length 1440: HTTP
2.078326 IP 100.1.2.1.8080 > 1.1.2.1.49153: Flags [.], ack 269281, win 32768, options [TS val 2078 ecr 2068,eol], length 0
2.078445 IP 1.1.2.1.49153 > 100.1.2.1.8080: Flags [.], seq 269281:270721, ack 1, win 32768, options [TS val 2068 ecr 2063,eol], length 1440: HTTP
2.078565 IP 1.1.2.1.49153 > 100.1.2.1.8080: Flags [.], seq 270721:272161, ack 1, win 32768, options [TS val 2068 ecr 2063,eol], length 1440: HTTP
2.078565 IP 100.1.2.1.8080 > 1.1.2.1.49153: Flags [.], ack 272161, win 32768, options [TS val 2078 ecr 2068,eol], length 0
2.078933 IP 1.1.2.1.49153 > 100.1.2.1.8080: Flags [.], seq 272161:273601, ack 1, win 32768, options [TS val 2068 ecr 2063,eol], length 1440: HTTP
2.079052 IP 1.1.2.1.49153 > 100.1.2.1.8080: Flags [.], seq 273601:275041, ack 1, win 32768, options [TS val 2068 ecr 2063,eol], length 1440: HTTP
2.079052 IP 100.1.2.1.8080 > 1.1.2.1.49153: Flags [.], ack 275041, win 32768, options [TS val 2079 ecr 2068,eol], length 0
